{
  "schema_version": "1.1.0",
  "goal_id": "06A",
  "identity": {
    "branch": {
      "value": "feat/planar-gap-assembly-correction",
      "confidence": "GH",
      "source": "local Git refs"
    },
    "branch_tip": {
      "value": "aadf996a05bf87efee862964141b6aeb7f872baf",
      "confidence": "GH",
      "source": "local Git refs"
    },
    "implementation_commit": {
      "value": "aadf996a05bf87efee862964141b6aeb7f872baf",
      "confidence": "GH",
      "source": "local Git object"
    },
    "policy_commit": {
      "value": null,
      "confidence": "U",
      "source": ""
    },
    "parent_baseline": {
      "value": "fa4436a2784574ffa336e87a9df898c35780a587",
      "confidence": "GH",
      "source": "Git ancestry"
    },
    "merge_base_main": {
      "value": "5c09db91a5a2cf363beb4750384f532a3308f995",
      "confidence": "GH",
      "source": "git merge-base main <branch>"
    },
    "merge_base_previous_goal": {
      "value": "fa4436a2784574ffa336e87a9df898c35780a587",
      "confidence": "GH",
      "source": "git merge-base <previous> <branch>"
    },
    "evidence_binding": {
      "value": "aadf996a05bf87efee862964141b6aeb7f872baf",
      "confidence": "L",
      "source": "outputs/planar_gap_assembly_correction_06a/revalidation_authorization_and_finite_evidence.json"
    }
  },
  "inputs": [
    {
      "fixture_id": "benchmarks-contact_tolerance_pilot_05a-A01_delta_m0_5tauE-inputs.step",
      "path": "benchmarks/contact_tolerance_pilot_05a/A01_delta_m0_5tauE/inputs.step",
      "sha256": "7f7a837239e2c44a09e99e5fcd17e2237e188486d3b1d44941f7fc35a3c43a09",
      "confidence": "L"
    },
    {
      "fixture_id": "benchmarks-contact_tolerance_pilot_05a-A01_delta_p0_5tauE-inputs.step",
      "path": "benchmarks/contact_tolerance_pilot_05a/A01_delta_p0_5tauE/inputs.step",
      "sha256": "802d1d379decdbfa8006e352f4881d9e289c0179235e64f9883f964e9f5404d8",
      "confidence": "L"
    },
    {
      "fixture_id": "benchmarks-contact_tolerance_pilot_05a-A01_delta_p0tauE-inputs.step",
      "path": "benchmarks/contact_tolerance_pilot_05a/A01_delta_p0tauE/inputs.step",
      "sha256": "02a9bb35d7cbd21cf911a22a426ef05b5c2aefb61d79523a35c2bf42d1c1f627",
      "confidence": "L"
    },
    {
      "fixture_id": "benchmarks-contact_tolerance_pilot_05a-A01_delta_p1_1tauE-inputs.step",
      "path": "benchmarks/contact_tolerance_pilot_05a/A01_delta_p1_1tauE/inputs.step",
      "sha256": "4829512bf3abddce5af645107d67bcfb3219c13495b1acf097780cb4ae1a803f",
      "confidence": "L"
    }
  ],
  "environment": {
    "freecad_version": {
      "value": null,
      "confidence": "U",
      "source": ""
    },
    "occt_version": {
      "value": null,
      "confidence": "U",
      "source": ""
    },
    "python_version": {
      "value": "3.12.0",
      "confidence": "L",
      "source": "preserved pytest log"
    },
    "pytest_version": {
      "value": "8.1.1",
      "confidence": "L",
      "source": "preserved pytest log"
    }
  },
  "execution": {
    "command": null,
    "exit_code": 0,
    "timestamp": "2026-09-09T20:54:58.222441",
    "confidence": "L"
  },
  "tolerances": [
    {
      "name": "tau_E",
      "value": 0.1,
      "unit": "mm",
      "role": "experiment/correction distance threshold",
      "source": "Goal benchmark or experiment evidence",
      "confidence": "L"
    },
    {
      "name": "linear_epsilon",
      "value": 1E-07,
      "unit": "mm",
      "role": "geometry validation",
      "source": "benchmarks/planar_gap_assembly_correction_06a/manifest.json",
      "confidence": "L"
    },
    {
      "name": "area_epsilon",
      "value": 1E-08,
      "unit": "mm^2",
      "role": "geometry validation",
      "source": "benchmarks/planar_gap_assembly_correction_06a/manifest.json",
      "confidence": "L"
    },
    {
      "name": "volume_epsilon",
      "value": 1E-06,
      "unit": "mm^3",
      "role": "geometry validation",
      "source": "benchmarks/planar_gap_assembly_correction_06a/manifest.json",
      "confidence": "L"
    }
  ],
  "artifacts": [
    {
      "artifact_id": "goal-06a-custody-0001",
      "kind": "SUPPORTING_EVIDENCE",
      "path": "outputs/planar_gap_assembly_correction_06a/checkpoint.json",
      "release_asset_name": null,
      "sha256": "1a88e1904070949274a19f3647e4cf905f602af51bfbc32cd7cba4ef0ed34f46",
      "size_bytes": 646,
      "validation_role": "supporting provenance or experiment evidence",
      "confidence": "L"
    },
    {
      "artifact_id": "goal-06a-custody-0002",
      "kind": "SUPPORTING_EVIDENCE",
      "path": "outputs/planar_gap_assembly_correction_06a/P01_repeatability.json",
      "release_asset_name": null,
      "sha256": "ce14c5a276e3de262c49113f4b3f0cedede33ffe679fbb65cdce10540e94eb57",
      "size_bytes": 455,
      "validation_role": "supporting provenance or experiment evidence",
      "confidence": "L"
    },
    {
      "artifact_id": "goal-06a-custody-0003",
      "kind": "STEP",
      "path": "outputs/planar_gap_assembly_correction_06a/P01/corrected_assembly.step",
      "release_asset_name": null,
      "sha256": "228a9932b56d7914ce683c411b3e176e41fcfa82fafeb417e8571cb16317c869",
      "size_bytes": 16236,
      "validation_role": "exchange geometry artifact; SHA-256 is integrity only",
      "confidence": "L"
    },
    {
      "artifact_id": "goal-06a-custody-0004",
      "kind": "SUPPORTING_EVIDENCE",
      "path": "outputs/planar_gap_assembly_correction_06a/P01/expected_snapshot.json",
      "release_asset_name": null,
      "sha256": "93f40825f7ce22b8325ce18166e649ea71e6a70dd198057325365df7652e00ae",
      "size_bytes": 191,
      "validation_role": "supporting provenance or experiment evidence",
      "confidence": "L"
    },
    {
      "artifact_id": "goal-06a-custody-0005",
      "kind": "STEP",
      "path": "outputs/planar_gap_assembly_correction_06a/P01/fused.step",
      "release_asset_name": null,
      "sha256": "f05b534d7239e568616c4d15024dff33ee41d44a083733760ac104c208e3f60d",
      "size_bytes": 7285,
      "validation_role": "exchange geometry artifact; SHA-256 is integrity only",
      "confidence": "L"
    },
    {
      "artifact_id": "goal-06a-custody-0006",
      "kind": "FCStd",
      "path": "outputs/planar_gap_assembly_correction_06a/P01/operation_debug.FCStd",
      "release_asset_name": null,
      "sha256": "414adfd12df9be6f4b3ac055c76f59090bc63510d872e87669dbf608efae5ed6",
      "size_bytes": 9226,
      "validation_role": "manual inspection/debug document",
      "confidence": "L"
    },
    {
      "artifact_id": "goal-06a-custody-0007",
      "kind": "SUPPORTING_EVIDENCE",
      "path": "outputs/planar_gap_assembly_correction_06a/P01/operation.json",
      "release_asset_name": null,
      "sha256": "c02d1b0688d7ebd1fbf53e7e7b990d9856a39e89685b4548f15a6e134f9d1489",
      "size_bytes": 4934,
      "validation_role": "supporting provenance or experiment evidence",
      "confidence": "L"
    },
    {
      "artifact_id": "goal-06a-custody-0008",
      "kind": "VALIDATOR",
      "path": "outputs/planar_gap_assembly_correction_06a/P01/validation.json",
      "release_asset_name": null,
      "sha256": "2b25ca1a4adcf91b01b8a9b1866fa15671e349cd3e54850049c9e09da4881f83",
      "size_bytes": 114,
      "validation_role": "artifact-backed validation evidence",
      "confidence": "L"
    },
    {
      "artifact_id": "goal-06a-custody-0009",
      "kind": "SUPPORTING_EVIDENCE",
      "path": "outputs/planar_gap_assembly_correction_06a/P02/expected_snapshot.json",
      "release_asset_name": null,
      "sha256": "5b55ed36f2665d93e00b8fdea8d75dd8d293bb3e710fd4a0d42f85bd6a8cfc31",
      "size_bytes": 193,
      "validation_role": "supporting provenance or experiment evidence",
      "confidence": "L"
    },
    {
      "artifact_id": "goal-06a-custody-0010",
      "kind": "SUPPORTING_EVIDENCE",
      "path": "outputs/planar_gap_assembly_correction_06a/P02/operation.json",
      "release_asset_name": null,
      "sha256": "98d784833438d1d5edd27a93630302eef45fc86cab87e885e8bad1572e6aa63c",
      "size_bytes": 2848,
      "validation_role": "supporting provenance or experiment evidence",
      "confidence": "L"
    },
    {
      "artifact_id": "goal-06a-custody-0011",
      "kind": "FCStd",
      "path": "outputs/planar_gap_assembly_correction_06a/P02/rejected_operation.FCStd",
      "release_asset_name": null,
      "sha256": "c21ee504cd7cafbd859c86ef1d4e4c6b731b86c6cdf6c0c605b42d08a5380fa5",
      "size_bytes": 4190,
      "validation_role": "manual inspection/debug document",
      "confidence": "L"
    },
    {
      "artifact_id": "goal-06a-custody-0012",
      "kind": "VALIDATOR",
      "path": "outputs/planar_gap_assembly_correction_06a/P02/validation.json",
      "release_asset_name": null,
      "sha256": "7d76d74184f51aa9832f24acc9f1afb5f82c05fbb83e5734798b47135415cc21",
      "size_bytes": 116,
      "validation_role": "artifact-backed validation evidence",
      "confidence": "L"
    },
    {
      "artifact_id": "goal-06a-custody-0013",
      "kind": "SUPPORTING_EVIDENCE",
      "path": "outputs/planar_gap_assembly_correction_06a/P03/expected_snapshot.json",
      "release_asset_name": null,
      "sha256": "6da3554df16795baf3b47ebd4e3cefc46b4b1b43326a26af216161da178b8c6b",
      "size_bytes": 199,
      "validation_role": "supporting provenance or experiment evidence",
      "confidence": "L"
    },
    {
      "artifact_id": "goal-06a-custody-0014",
      "kind": "SUPPORTING_EVIDENCE",
      "path": "outputs/planar_gap_assembly_correction_06a/P03/operation.json",
      "release_asset_name": null,
      "sha256": "7a0d5cb4623e9cd39e99aa0825cf50cb7d8d22d1a27fc969b560b75091038580",
      "size_bytes": 2626,
      "validation_role": "supporting provenance or experiment evidence",
      "confidence": "L"
    },
    {
      "artifact_id": "goal-06a-custody-0015",
      "kind": "VALIDATOR",
      "path": "outputs/planar_gap_assembly_correction_06a/P03/validation.json",